{
  "certificate_id": "a0034654-8fed-4787-86cb-2d7015b8a06f",
  "timestamp_utc": "2026-02-26T22:09:31Z",
  "engine_signature": {
    "version": "GRUT-RAI-v0.2",
    "canon_hash": "bdb71ddc06c077cd4daf44730b38ae4d3d81d8101f0b53ba51100156c4b0372f",
    "determinism_mode": "STRICT"
  },
  "inputs": {
    "input_state_hash": "ca60d85d3a520a1f6732c2df3312216a7f0d486c64e8d7cf8d8dea952277228f",
    "run_config_hash": "de828d64dab09d2d56659fe75ffec1abcfa1ee7f32e82b87ce7529c0d826d2a6",
    "assumption_toggles": {
      "deterministic_run": true,
      "growth_enabled": true
    }
  },
  "run_trace": {
    "operator_stack_keys": [
      "OP_GENESIS",
      "OP_S_PHASE",
      "OP_L_STIFF",
      "OP_DISSIPATION",
      "OP_TAU_COUPLING",
      "OP_GROWTH_LINEAR"
    ],
    "operators_executed_ids": [
      "OP_GENESIS_001",
      "OP_S_PHASE_001",
      "OP_L_STIFF_001",
      "OP_DISSIP_001",
      "OP_COSMO_COUPLE_001",
      "OP_GROWTH_LINEAR_001"
    ],
    "operator_execution_counts": {
      "OP_GENESIS_001": 1,
      "OP_S_PHASE_001": 300,
      "OP_L_STIFF_001": 300,
      "OP_DISSIP_001": 300,
      "OP_COSMO_COUPLE_001": 300,
      "OP_GROWTH_LINEAR_001": 300
    },
    "steps_computed": 300,
    "dt_years": 100000.0,
    "integrator": "RK4",
    "convergence_metric": null,
    "warnings": [
      "GROWTH_DERIV_HELD"
    ],
    "growth_enabled": true,
    "memory_update_scheme": "EXACT_EXPONENTIAL_STRANG",
    "max_dt_over_tau_eff": 0.002386634844868735,
    "fsigma8_masking_enabled": true,
    "H_floor": 1e-12,
    "H_floor_count": 300,
    "fs8_masked_count": 300,
    "growth_sigma8_0": 0.811,
    "growth_D0": 1e-30,
    "fs8_mask_rule": "H < 1e-12 or D <= 0",
    "fs8_mask_H_floor": 1e-12,
    "rms_definition": "rms = sqrt(mean((x_i - x_i_baseline)^2)); fs8 uses aligned points where both baseline and run are unmasked and fsigma8 is not None",
    "rms_n_points": {
      "H": 300,
      "fs8": 0
    }
  },
  "outputs": {
    "observables_emitted": [
      "OBS_HZ_001",
      "OBS_FS8_001"
    ],
    "output_digest": "52a8c59ff37d8ee4d663c345d610404029a78b405e173fad856736caab2f0447"
  },
  "falsification_check": null,
  "initial_conditions": {
    "t0_years": 0.0,
    "genesis_mode": "steady_state",
    "driver": "X=H_base^2",
    "H_base2_t0": -0.549999997,
    "M_X_t0": -0.549999997,
    "H_t0": 0.0,
    "tau_eff_t0": 41900000.0,
    "transient_warning": false,
    "a_init_used": 0.3333333333333333,
    "rho_init_used": 0.2,
    "p_init_used": -0.2,
    "w_effective_init": -1.0,
    "start_z_used": 2.0,
    "start_z": 2.0,
    "a_init": 0.3333333333333333,
    "rho_init": 0.2,
    "rho_m_init": 0.0,
    "rho_is_rho0": true,
    "rho0_input": 0.2,
    "rho_m0_input": 0.0,
    "rho_m_init_used": 0.0,
    "p0_input": -0.2,
    "w_eff_used_for_inference": -1.0,
    "rho_init_inferred": 0.2,
    "dlna_target": 0.0036620409622270325,
    "growth_init": {
      "mode": "growing_mode",
      "a_init": 0.33455625147557466,
      "D_init": 1e-30,
      "Dp_init": 0.0
    }
  },
  "repro_hash": "87eeec3275ab57152780e280151c4db0b588e1d938caedc179aac40803f67f37"
}